title,imdb_id,year,summary,people,decade,people_count,has_summary,language
ABCD 2,tt3679000,2015.0,"Disney's ABCD 2, also known as Any Body Can Dance 2, is a 2015 Indian Hindi-language dance film directed and choreographed by Remo D'Souza and produced by Siddharth Roy Kapur under Walt Disney Pictures. A stand-alone sequel to the 2013 film ABCD: Any Body Can Dance, the film stars Prabhu Deva, Varun Dhawan and Shraddha Kapoor in the lead roles alongside Sushant Pujari, and is partially inspired by the life accounts of Suresh Mukund and Vernon Monteiro, played respectively by Dhawan and Pujari, founders of the ""fictitious dance crew"" The Kings, who went on to win the World Hip Hop Dance Championship in San Diego.",Christine Vienna; Dharmesh Yelande; Lauren Gottlieb; Prabhu Deva; Prachee Shah Pandya; Raghav Juyal; Remo D'Souza; Shraddha Kapoor; Siddharth Roy Kapur; Tushar Hiranandani; Varun Dhawan,2010.0,11,True,Hindi
Aashiqui (2015 film),tt5143402,2015.0,"Aashiqui: True Love is a 2015 romantic drama film directed by Ashok Pati and produced by FB Ltd Productions and Jaaz Multimedia. The film stars Ankush Hazra and Nusrat Faria Mazhar in lead roles, and Moushumi in a supporting role.",Ankush Hazra; Ashok Dhanuka; Ashok Pati; Moushumi; Nusraat Faria Mazhar; Rajatava Dutta; Sourav Das,2010.0,7,True,
Ab Tak Chhappan 2,tt2202086,2015.0,"Ab Tak Chhappan 2 is a 2015 Indian Hindi-language action thriller film produced by Raju Chada and Gopal Dalvi. The film is directed by Aejaz Gulab and scripted by Nilesh Girkar. The film stars Nana Patekar in the lead role. It also stars Gul Panag, and Ashutosh Rana. The film is a sequel to the crime drama Ab Tak Chhappan. The film was released on 27 February 2015 and met with mixed to positive reviews. The story revolves around Inspector Sadhu Agashe from the Mumbai Encounter Squad. It is inspired by the life of Police sub-Inspector with Mumbai Police force Daya Nayak.",Ejaz Gulab; Nana Patekar; Nilesh Girkar,2010.0,3,True,Hindi
Aligarh (film),tt5121000,2015.0,Aligarh is a 2015 Indian Hindi biographical drama film directed by Hansal Mehta and written by Apurva Asrani. It stars Manoj Bajpayee and Rajkummar Rao in the lead roles.,Apurva Asrani; Hansal Mehta; Rajkummar Rao,2010.0,3,True,
Alone (2015 Hindi film),tt4271730,2015.0,"Alone is a 2015 Indian horror film directed by Bhushan Patel, starring Bipasha Basu and Karan Singh Grover. The film is a remake of the 2007 Thai film of the same name, which was itself based on the Tales From The Crypt episode ""My Brothers Keeper"". A similar movie Chaarulatha was released in 2012. The film marked the acting debut of Karan Singh Grover as well as the final film appearance of Bipasha Basu.",Bhushan Patel; Bipasha Basu; Karan Singh Grover; Zakir Hussain,2010.0,4,True,
Amma (unreleased film),,2015.0,"Amma is an unreleased multilingual Indian film written and directed by Faisal Saif, and produced by C. R. Manohar under the banner of Tanvi Films. Filmed in Hindi and Kannada, the film is Sandalwood star Ragini Dwivedi's second film to be launched on her birthday after Ragini IPS.",C. R. Manohar; Faisal Saif; Ragini Dwivedi,2010.0,3,True,
Anegan,tt2002868,2015.0,"Anegan is a 2015 Indian Tamil-language period romantic action thriller film co-written and directed by K. V. Anand and produced by Kalpathi S. Aghoram, S. Ganesh, and S. Suresh under the banner of AGS Entertainment. The film features an ensemble cast starring Dhanush and Amyra Dastur in quadruple roles, while Karthik, Ashish Vidyarthi, Aishwarya Devan, Mukesh Tiwari and Jagan appear in supporting roles. The plot of this story is inspired by the 1963 film Nenjam Marapathillai. The film's title is based on Thiruvasagam, which was written by poet Manikkavacakar. Set in four different time periods, the film is based on the theme of reincarnation, which revolves around Ashwin (Dhanush) and Madhu who were lovers in their past lives, have been brought together in the present.",Dhanush; K. V. Anand,2010.0,2,True,Tamil
Baby (2015 Tamil film),tt14353710,2015.0,Baby is a 2015 Indian Tamil-language horror film directed by D Suresh. The story revolves around a separated couple who later reunite to protect their daughter from being haunted.,,2010.0,0,True,Tamil
Balkadu,tt4373944,2015.0,"Balkadu is a 2015 Indian Marathi language film. The film stars Umesh Kamat, Neha Pendse and Prasad Oak in lead roles and stars Supriya Pathare, Tiku Talsania, Pushkar Shrotri, Anand Ingale in supporting roles. Balkadu was directed by Atul Kale and produced by Swapna Patker. Balkadu is loosely expected to be based on the ideologies of Indian politician Bal Thackeray, the film contains voice clippings of Thackeray's political career.",Atul Kale; Neha Pendse; Swapna Patker; Umesh Kamat,2010.0,4,True,Marathi
Bangalore 560023,tt5343960,2015.0,"Bangalore 560023 is a 2015 Indian Kannada-language sports comedy film directed by Pradeep Raj. The film stars Karthik Jayaram, Chandan Kumar, Dhruv Sharma, Chikkanna, Rajeev and Naveen Naidu and along with Sanjjana and Shivani, making her acting debut. It is a remake of the Tamil film Chennai 600028 (2007).",Jayram Karthik; Pradeep Raj; Venkat Prabhu,2010.0,3,True,Kannada
Beeba Boys,tt4170186,2015.0,"Beeba Boys is a 2015 Canadian crime thriller film written and directed by Deepa Mehta. It stars Randeep Hooda as Jeet Johar, a loving single father, a dutiful son, a proud, observant Sikh and a ruthless gangster managing a team of stylish, charismatic but brutal and unforgiving young men. The film is a fictional take based on real incidents, including Bindy Johal.",Ali Kazmi; Balinder Johal; Deepa Mehta; Dileep Rao; Gulshan Grover; Paul Gross; Randeep Hooda; Sarah Allen; Waris Ahluwalia,2010.0,9,True,
Bhooloham,tt3557988,2015.0,"Bhooloham (transl. World) is a 2015 Indian sports action film directed by N. Kalyanakrishnan and produced by Aascar Films. It stars Ravi Mohan and Trisha Krishnan, while Nathan Jones and Prakash Raj play pivotal roles as antagonists.",Arpit Ranka; N. Kalyanakrishnan; S. P. Jananathan; Viswanathan Ravichandran,2010.0,4,True,
Buddhanin Sirippu,tt18257592,2015.0,"Buddhanin Sirippu is a 2015 Tamil language drama film directed by Victor Davidson. The film stars Samuthirakani, Mahesh and Suresh Sakaria with Mithra Kurian and Vivek in supporting roles. Music for the film was composed by Alimirzaq and it opened to mixed reviews in June 2015.",Samuthirakani,2010.0,1,True,Tamil
Calendar Girls (2015 film),tt4897908,2015.0,"Calendar Girls is a 2015 Indian Hindi-language drama film directed by Madhur Bhandarkar and co-produced by Sangeeta Ahir and Bhandarkar Entertainment. Akanksha Puri played the main female lead role. The film's music was composed by Meet Bros Anjjan and Amaal Mallik. The film was released on 25 September 2015. According to Bhandarkar, the story of Calendar Girls is 75% reality and 25% fiction.",Kyra Dutt; Madhur Bhandarkar,2010.0,2,True,Hindi
Chandrettan Evideya,tt4648304,2015.0,"Chandrettan Evideya is a 2015 Malayalam-language romantic fantasy comedy film directed by Sidharth Bharathan. The film was produced by Sameer Thahir, Shyju Khalid and Ashiq Usman. It stars Dileep alongside Anusree and Namitha Pramod in the main roles. It is the second directorial of Sidharth. The story and screenplay is penned by noted author Santhosh Echikkanam who had teamed up with Sidharth in his directorial debut Nidra (2012). The songs are composed by Prashant Pillai. Cinematography is handled by Shyju Khalid and editing by Bavan Sreekumar. The costumes are designed by Mashar T Hamsa.",Dileep (Gopalakrishnan P Pillai); Sameer Thahir; Santhosh Echikkanam; Sidharth Bharathan,2010.0,4,True,Malayalam
Dirty Politics (film),tt4501576,2015.0,Dirty Politics is a 2015 Indian Hindi-language political thriller written and directed by K. C. Bokadia with an ensemble cast. The film was released on 6 March 2015 with an adult rating due to its strong sexual content. It was a box office disaster.,Ashutosh Rana; K. C. Bokadia; Mallika Sherawat; Om Puri,2010.0,4,True,Hindi
Dolly Ki Doli,tt4332114,2015.0,"Dolly Ki Doli is a 2015 Indian Hindi-language comedy-drama film, directed by debutant Abhishek Dogra and produced by actor Arbaaz Khan under his production house Arbaaz Khan Productions. The film stars Sonam Kapoor in the title role and also features Pulkit Samrat, Rajkummar Rao and Varun Sharma. The film was released on 23 January 2015. The trailer for the film was released in December 2014, on the anniversary of Malaika and Arbaaz. It is a remake of the 2013 Punjabi film R.S.V.P. - Ronde Saare Vyah Picho.",Abhishek Dogra; Arbaaz Khan; Sonam Kapoor; Umashanker Singh,2010.0,4,True,Hindi
Dulaara (2015 film),tt4868958,2015.0,"Dulaara is a 2015 Indian Bhojpuri language film produced and directed by Rajkumar R. Pandey. It stars, Pradeep Pandey ""Chintu"", Tanushree Chatterjee, Mohini Ghosh, Manoj Tiger, Gopal Rai, Awadhesh Mishra, Rani Chatterjee. In this movie Pradeep Pandey aka chintu is in lead role and Tanushree Chatterjee, Ritu Singh and Mohini Ghosh are in his opposite.",Rajkumar R. Pandey,2010.0,1,True,Bhojpuri
Eli (2015 film),tt4786638,2015.0,"Eli (transl. Rat) is a 2015 Indian Tamil-language spy comedy written and directed by Yuvaraj Dhayalan. The film stars Vadivelu and Sadha. Vidyasagar composed the film's music. Eli, set in the 1960s, focuses on a small-time thief who is recruited by the police to infiltrate a gang in an effort to thwart an illegal cigarette smuggling scheme. The film was released on 19 June 2015 to mostly mixed to positive reviews and became a box office success.",Vadivelu; Yuvaraj Dhayalan,2010.0,2,True,Tamil
Ennu Ninte Moideen,tt4888834,2015.0,"Ennu Ninte Moideen is a 2015 Indian Malayalam-language biographical romantic drama film written and directed by R. S. Vimal, based on the real-life story of Kanchanamala and B. P. Moideen, which took place in the 1960s in Mukkam, Kozhikode. Prithviraj Sukumaran and Parvathy Thiruvothu essay the title characters of Moideen and Kanchanamala while Bala, Tovino Thomas, Sai Kumar, Sashi Kumar and Lena appear in supporting roles.",Prithviraj Sukumaran; R. S. Vimal,2010.0,2,True,Malayalam
Fraud Saiyaan,tt5013008,2015.0,"Fraud Saiyaan is a 2019 Indian Hindi-language romantic dark comedy drama film directed by Sourabh Shrivastava and produced by Prakash Jha, Disha Jha and Kanishk Gangwal. The film stars Arshad Warsi, Saurabh Shukla and Sara Loren, and features Deepali Pansare, Flora Saini and Nivedita Tiwari in supporting roles. Filming locations included Obedullaganj, Raisen, Bhopal and Mumbai. The soundtrack was composed by Sohail Sen, while Udai Prakash Singh handled the art direction. The film was released worldwide on 18 January 2019.",Arshad Warsi; Prakash Jha; Sara Loren; Sourabh Shrivastava,2010.0,4,True,Hindi
Gabbar Is Back,tt2424988,2015.0,"Gabbar Is Back is a 2015 Indian Hindi-language vigilante action thriller film directed by Krish in his Hindi debut, written by Rajat Arora and produced by Sanjay Leela Bhansali. The film stars Akshay Kumar and Shruti Haasan with Kareena Kapoor Khan in a special appearance.",Akshay Kumar; Govind Namdev; Ishita Vyas; Nikitin Dheer; Prakash Raj; Radhakrishna Jagarlamudi; Rajat Arora; Sanjay Leela Bhansali; Shruti Haasan; Sonu Sood; Suman; Viacom18 Studios,2010.0,12,True,Hindi
Gaddar: The Traitor,tt4718728,2015.0,"Gaddar: The Traitor is a 2015 Indian Punjabi thriller starring Manpneet Grewal, Harbhajan Mann and Amitoj Mann. The film was released on 29 May 2015.",Amitoj Maan; Harbhajan Mann,2010.0,2,True,
Goa (2015 film),tt5782550,2015.0,"Goa is a 2015 Indian Kannada romantic comedy film directed by Surya. It stars Komal Kumar, Tarun Chandra, Srikanth, Sharmila Mandre, Sonu and British theatre artiste Rachel Wise in lead roles. The film is an official remake of the Tamil film of the same title (2010) directed by Venkat Prabhu. The film features the music composed by Arjun Janya whilst the cinematography is by Rajesh Katta.",Komal; Venkat Prabhu,2010.0,2,True,
Godhi Banna Sadharana Mykattu,tt4909506,2015.0,"Godhi Banna Sadharana Mykattu is a 2016 Indian Kannada drama film written and directed by Hemanth Rao, making his debut, and produced by Pushkara Mallikarjun under Pushkar Films. The film stars Anant Nag and Rakshit Shetty in the lead roles with Achyuth Kumar, Sruthi Hariharan, Vasishta N. Simha and Ravikiran portraying supporting roles. The movie was a commercial success at the box office.",Anant Nag; Hemanth M. Rao,2010.0,2,True,
Gour Hari Dastaan,tt4513812,2015.0,"Gour Hari Dastan – The Freedom File is a 2015 Indian, biographical film on freedom fighter Gour Hari Das, directed by Anant Mahadevan. The film starred Vinay Pathak, Konkona Sen Sharma, Ranvir Shorey and Tannishtha Chatterjee, among others. The film depicts the life of the Indian freedom fighter from Odisha, Sri Gour Hari Das.",Anant Mahadevan; C. P. Surendran; Vinay Pathak,2010.0,3,True,
Guddu Rangeela,tt4684028,2015.0,"Guddu Rangeela is an Indian action black comedy film, directed by Subhash Kapoor. It stars Arshad Warsi, Amit Sadh and Ronit Roy in lead roles. The film is presented by Fox Star Studios and produced by Sangeeta Ahir. Guddu Rangeela has incorporated the Manoj-Babli honour killing case in the storyline. The film received mixed reviews upon release and was a major commercial failure at the box office.",Ronit Roy; Subhash Kapoor,2010.0,2,True,
Hawaizaada,tt4338154,2015.0,"Hawaizaada (transl. 'Airborne') is a 2015 Indian Hindi drama film written, directed and produced by Vibhu Puri along with Reliance Entertainment. Inspired by the biography of Shivkar Bapuji Talpade, the film stars Ayushmann Khurrana, Mithun Chakraborty and Pallavi Sharda. Talpade, a resident of Bombay, is claimed to have constructed and flown an unmanned, heavier-than-air aircraft in 1895. Contemporary accounts of a successful flight do not exist, and no reliable historical records document its existence. The film depicts Talpade successfully conducting a manned flight. It was released on 30 January 2015. The film was declared tax-free in Uttar Pradesh.",Ayushmann Khurrana; Mithun Chakraborty; Pallavi Sharda; Vibhu Puri,2010.0,4,True,
India's Daughter,tt4058426,2015.0,"India's Daughter is a documentary film directed by Leslee Udwin and is part of the BBC's ongoing Storyville series. The film is based on the 2012 Delhi gang rape and murder of 22-year-old Jyoti Singh, aliased ""Nirbhaya"", who was a physiotherapy student. The documentary explores the events of the night of 16 December 2012, the protests which were sparked both nationally and internationally as a result of the assault, and the lives of the men before they committed the attack. The film is told through the use of reconstructed footage and interviews with those involved in the case, including the defence lawyers, psychiatrists, and one of the rapists.",Leslee Udwin,2010.0,1,True,
Isai,tt4401884,2015.0,"Isai (transl. Music) is a 2015 Indian Tamil-language musical thriller film written, directed and composed by S. J. Suryah, who starred himself in the lead role alongside Sathyaraj and Sulagna Panigrahi in her film debut. The film marked Suryah's return to direction after a five-year hiatus since 2010, and also his debut as a music director. The film revolves around the rivalry between Vetriselvan, an established veteran composer and A. K. Shiva, his assistant and an emerging composer in the film industry.",S. J. Surya; Sathyaraj; Sulagna Panigrahi,2010.0,3,True,Tamil
Janda Pai Kapiraju,tt3916754,2015.0,,Chandra Mohan; Nani; Samuthirakani,2010.0,3,False,
Kaaki Sattai (2015 film),tt4415326,2015.0,,Dhanush; Imman Annachi; Manobala; Pattukkottai Prabakar; Prabhu Ganesan; R. S. Durai Senthilkumar; Sivakartikeyan; Sri Divya; Vijay Raaz,2010.0,9,False,
Kanche,tt5137380,2015.0,,Pragya Jaiswal; Radhakrishna Jagarlamudi; Varun Tej,2010.0,3,False,
Kaun Kitne Paani Mein,tt3477214,2015.0,,Gulshan Grover; Kunal Kapoor; Nila Madhab Panda; Radhika Apte; Saurabh Shukla,2010.0,5,False,
Kumbasaram,tt4698000,2015.0,"Kumbasaram: The Confession is a 2015 Indian Malayalam thriller film written and directed by Aneesh Anwar, starring Jayasurya, Honey Rose, Vineeth and Priyanka. The film features music composed by Vishnu Mohan Sithara. The music label was Muzik247. The film deals with the unexpected tragedies that befall the family of an autorickshaw driver. The movie is an unofficial remake of Serbian film Klopka with few little changes. It released on 22 May 2015.",Aneesh Anwar; Jayasurya Jayan,2010.0,2,True,
Loev,tt5050788,2015.0,,Shiv Pandit; Siddharth Menon; Sudhanshu Saria,2010.0,3,False,
MSG: The Messenger,tt4107858,2015.0,,Gurmeet Ram Rahim Singh,2010.0,1,False,
Manjhi – The Mountain Man,tt3449292,2015.0,,Deepa Sahi; Ketan Mehta; Nawazuddin Siddiqui; Pankaj Tripathi; Radhika Apte; Tigmanshu Dhulia,2010.0,6,False,
Maya (2015 Tamil film),tt5037912,2015.0,,Ashwin Saravanan; Md. Hafizur Rahman; Nayanthara,2010.0,3,False,
Moondraam Ullaga Por,tt4020644,2015.0,,Akhila Kishore; Sugan Kartthi,2010.0,2,False,
Naanu Avanalla...Avalu,tt5368224,2015.0,,B. S. Lingadevaru; Sanchari Vijay,2010.0,2,False,
Naxal (film),tt4796654,2015.0,,Dhritiman Chatterjee; Gargi Roychowdhury; Kanchana Moitra; Kopil Bora; Mithun Chakraborty; Shankar Chakraborty,2010.0,6,False,
Pasanga 2,tt5285050,2015.0,,Pandiraj; Suriya,2010.0,2,False,
Patel Ki Punjabi Shaadi,tt3209826,2015.0,,Bharat Patel; Paresh Rawal; Sanjay Chhel,2010.0,3,False,
Porkalathil Oru Poo,tt5467752,2015.0,,,2010.0,0,False,
Puli (2015 film),tt3803860,2015.0,,Chimbu Deven; Hansika Motwani; Nandita Swetha; Shibu Thameens; Shruti Haasan; Sridevi; Sudeepa; Vijay,2010.0,8,False,
Puthiya Niyamam,tt5323568,2015.0,,A. K. Sajan; Mammootty; Nayanthara,2010.0,3,False,
Rana Vikrama,tt4597454,2015.0,,Adah Sharma; Anjali; Dr. Puneeth Rajkumar; Girish Karnad; Pawan Wadeyar; Rangayana Raghu; Vikram Singh,2010.0,7,False,
Rani Padmini (film),tt4680564,2015.0,,Aashiq Abu; Manju Warrier; Rima Kallingal,2010.0,3,False,
S/O Satyamurthy,tt4596814,2015.0,,Adah Sharma; Allu Arjun; Brahmanandam; Prakash Raj; Rajendra Prasad; S. Radha Krishna; Samantha Ruth Prabhu; Trivikram Srinivas; Upendra; Vennela Kishore,2010.0,10,False,
Sandamarutham,tt3822410,2015.0,,A. Venkatesh; R. Sarathkumar,2010.0,2,False,
Shaandaar (2015 film),tt4007558,2015.0,,Alia Bhatt; Anjana Sukhani; Anurag Kashyap; Anvita Dutt; Karan Johar; Niki Aneja Walia; Pankaj Kapur; Sanjay Kapoor; Shahid Kapoor; Sushma Seth; Vikas Bahl,2010.0,11,False,
Sher (film),tt5191308,2015.0,,Ashish Vidyarthi; Brahmanandam; Mukesh Rishi; Nandamuri Kalyan Ram; Sonal Chauhan; Vikramjeet Virk,2010.0,6,False,
Srimanthudu,tt4727512,2015.0,"Srimanthudu is a 2015 Indian Telugu-language action drama film written and directed by Koratala Siva. The film is produced by Mythri Movie Makers and G. Mahesh Babu Entertainment. The film stars Mahesh Babu, Shruti Haasan, Jagapati Babu and Rajendra Prasad. Sampath Raj, Mukesh Rishi, Sukanya and Harish Uthaman appear in supporting roles. It was distributed globally by Eros International.",Ali; Anand; Angana Roy; Harish Uthaman; Jagapati Babu; Koratala Siva; Mahesh Babu; Mukesh Rishi; Rahul Ravindran; Rajendra Prasad; Sampath Raj; Sanam Shetty; Shruti Haasan; Sithara; Sivaji Raja; Subbaraju; Sukanya; Surekha Vani; Tejaswi Madivada; Tulasi; Vennela Kishore,2010.0,21,True,Telugu
Style (2016 film),tt5239564,2015.0,,Binu Sadanandan; Unni Mukundan,2010.0,2,False,
Talvar (film),tt4934950,2015.0,,Gajraj Rao; Irrfan Khan; Konkona Sen Sharma; Meghna Gulzar; Neeraj Kabi; Neyha Sharma; Prakash Belawadi; Shishir Sharma; Sohum Shah; Sumit Gulati; Tabu; Vineet Jain; Vishal Bhardwaj,2010.0,13,False,
Tamizhuku En Ondrai Azhuthavum,tt3982482,2015.0,,Nakul; Ramprakash Rayappa,2010.0,2,False,
Tanu Weds Manu Returns,tt2140465,2015.0,,Aanand L. Rai; Deepak Dobriyal; Eijaz Khan; Himanshu Sharma; Jimmy Shergill; K. K. Raina; Kangana Ranaut; Krishika Lulla; Manu Rishi; Mohammed Zeeshan Ayyub; Navni Parihar; R. Madhavan; Rajendra Gupta; Rajesh Sharma; Swara Bhaskar,2010.0,15,False,
Temper (film),tt4442758,2015.0,,Ganesh Babu; Kajal Aggarwal; Kota Srinivasa Rao; N. T. Rama Rao Jr.; Prakash Raj; Puri Jagannadh; Vakkantham Vamsi,2010.0,7,False,
Thani Oruvan,tt4987556,2015.0,,Jayam Ravi; M. Raja,2010.0,2,False,
The Fourth Direction,tt4636068,2015.0,,Gurpreet Bhangu; Gurvinder Singh; Kanwaljeet Singh; Waryam Singh Sandhu,2010.0,4,False,
The Mastermind Jinda Sukha,tt7943238,2015.0,,Gugu Gill; Harjinder Singh Jinda; Nav Bajwa; Satwant Kaur,2010.0,4,False,
The Vanishing Act,tt3781948,2015.0,,Rupesh Paul,2010.0,1,False,
Thilagar,tt8108232,2015.0,,Kishore Kumar,2010.0,1,False,
Thiranthidu Seese,tt4701664,2015.0,,Sai Dhanshika,2010.0,1,False,
Thoongaa Vanam,tt4937812,2015.0,"Thoongaa Vanam is a 2015 Indian action thriller film directed by Rajesh M. Selva. The film stars an ensemble cast including Kamal Haasan, Prakash Raj, Trisha Krishnan, Kishore, Sampath Raj, Guru Somasundaram, Yugi Sethu, Aman Abdullah, Asha Sharath, Madhu Shalini and Jagan. It was filmed simultaneously in Tamil and Telugu languages, the latter titled Cheekati Rajyam. Both versions were produced by Raaj Kamal Films International and Sree Gokulam Movies. The film is a remake of the French film Sleepless Night (2011).",Kamal Haasan; Rajesh Selva,2010.0,2,True,Telugu
Time Out (2015 film),tt4396648,2015.0,,Rikhil Bahadur,2010.0,1,False,
Unakkenna Venum Sollu,tt4968570,2015.0,,,2010.0,0,False,
Visaranai,tt4991384,2015.0,,Attakathi Dinesh; Vetrimaaran,2010.0,2,False,
Wedding Pullav,tt4651394,2015.0,,Binod Pradhan; Diganth; Pooja Verma,2010.0,3,False,
Yagavarayinum Naa Kaakka,tt4435282,2015.0,,Aadhi Pinisetty; Ravi Raja Pinisetty; Sathya Prabhas Pinisetty,2010.0,3,False,
1 by Two,tt3686130,2014.0,"1 by Two is a 2014 Indian Malayalam language psychological thriller film directed by Arun Kumar Aravind and written by Jeyamohan. It stars Fahadh Faasil, Murali Gopy in dual roles, Honey Rose and Abhinaya.",Abhinaya; Arun Kumar Aravind; B Rakesh; Fahadh Faasil; Honey Rose; Jeyamohan; Murali Gopy,2010.0,7,True,Malayalam
1983 (film),tt3506970,2014.0,"1983 is a 2014 Indian Malayalam-language coming-of-age sports film directed by fashion photographer Abrid Shine, who wrote the story and co-wrote the script with Bipin Chandran. The film, produced under the banner of Shams Films, stars Nivin Pauly in the lead role. Anoop Menon, Nikki Galrani, Joy Mathew, Srinda Arhaan, Jacob Gregory, Saiju Kurup, Binoy Antony, Shine Tom Chacko, Dinesh, Sui Joseph, Neeraj Madhav and Sanju, make up the rest of the cast. Pradeesh Varma cranked the camera and the music director was Gopi Sunder, for which he received the 62nd National Film Awards for Best Background Score.",Abrid Shine; Arun Cherukavil; Nivin Pauly,2010.0,3,True,Malayalam
22 Yards,tt9496212,2014.0,"22 Yards is a 2018 Indian sports drama film starring Barun Sobti, Rajit Kapur, Panchi Bora and Rajesh Sharma. The film has been directed by sports journalist turned filmmaker Mitali Ghoshal. The film premiered at the 2018 Bay Area South Asian Film Festival and was released theatrically on 15 March 2019. The trailer of the film was launched by Sourav Ganguly.",Barun Sobti,2010.0,1,True,
47 to 84,tt4847478,2014.0,"47 to 84 is an Indian Punjabi film based on a realistic story that has been shot in Punjab, Chandigarh, New Delhi and the nearby areas. This movie is about the journey of a child through the traumatic times of the India-Pakistan partition, and when her life was finally heading to normalcy, the 84 riots happened. The film is directed by Rajiv Sharma and produced by Babli Singh. The film was released on 30 May 2014.",Neelam Sivia; Rajeev Kumar,2010.0,2,True,
Aaha Kalyanam,tt2995992,2014.0,"Aaha Kalyanam is a 2014 Indian Tamil-language romantic comedy film directed by debutant A. Gokul Krishna and produced by Aditya Chopra's Yash Raj Films. A remake of Maneesh Sharma's 2010 Hindi film, Band Baaja Baaraat, the film stars Simran, Nani and Vaani Kapoor. Although it was planned for bilingual release, it was shot completely in Tamil, and a dubbed Telugu version was released simultaneously along with the Tamil version. The film was released worldwide on 21 February 2014.",Aditya Chopra; Gokul Krishna; Maneesh Sharma; Nani; Vaani Kapoor,2010.0,5,True,Tamil
Action Jackson (2014 film),tt0403935,2014.0,"Action Jackson is a 2014 Indian Hindi-language action film directed by Prabhu Deva and produced by Gordhan P. Tanwani and Sunil Lulla. A remake of the 2008 Bengali film Mr. Funtoosh starring Prosenjit Chatterjee, the name of the film is borrowed from the 1988 American film of the same name. It stars Ajay Devgn in a dual role, alongside Yami Gautam, Sonakshi Sinha, Manasvi Mamgai, Kunaal Roy Kapur and Anandaraj.",Ajay Devgn; Anandaraj; Kunaal Roy Kapur; Manasvi Mamgai; Prabhu Deva; Rocky Verma; Sonakshi Sinha; Srinu Vaitla; Yami Gautam,2010.0,9,True,Hindi
Ajoba,tt2954770,2014.0,"Ajoba is a 2014 Indian Marathi-language film directed by Sujay Dahake and written by Gauri Bapat. Allegedly based on true events, it tells the story of a leopard’s remarkable 29 days journey from Malshej Ghat to Mumbai. Ajoba was rescued from a well and a tracking device was fixed on his neck, before being released back into the wild. He made his way to Mumbai over the Sahyadris, a distance of 120 kilometres (75 mi).",Sujay Dahake; Urmila Matondkar,2010.0,2,True,Marathi
