title,imdb_id,year,summary,people,decade,people_count,has_summary,language
Fight Club: Members Only,tt0456413,2006.0,"Fight Club: Members Only is a 2006 Indian Hindi-language action thriller film directed by Vikram Chopra and produced by Ravi Walia and Sohail Khan. The film features an ensemble cast of Suniel Shetty, Sohail Khan, Zayed Khan, Dino Morea, Ritesh Deshmukh, Aashish Chaudhary, Rahul Dev, Dia Mirza and Amrita Arora while Ashmit Patel, Yash Tonk, Kulbhushan Kharbanda and Neha Dhupia are featured in crucial roles. Its plot borrows heavily from the 1999 American film Fight Club.",Aashish Chaudhary; Amrita Arora; Dia Mirza; Dino Morea; Kulbhushan Kharbanda; Mayur Puri; Ravi Walia; Riteish Deshmukh; Sohail Khan; Sunil Shetty; Vikram Chopra; Zayed Khan,2000.0,12,True,Hindi
Gafla,tt0896934,2006.0,Gafla is a 2006 Indian Hindi-language crime drama film directed by Sameer Hanchate. It is a film inspired from the stock market scam of 1992 which mainly involved Harshad Mehta that rocked the Indian economy and changed lives of thousands forever.,,2000.0,0,True,Hindi
Gangster: A Love Story,tt0495032,2006.0,"Gangster: A Love Story is a 2006 Indian Hindi-language romantic thriller film directed by Anurag Basu. It stars Kangana Ranaut, Emraan Hashmi and Shiney Ahuja in lead roles. The film was produced by Mahesh Bhatt and Mukesh Bhatt of Vishesh Films. The music was composed by Pritam.",Anurag Basu; Emraan Hashmi; Kangana Ranaut; Mahesh Bhatt; Mukesh Bhatt; Shiney Ahuja,2000.0,6,True,Hindi
Golmaal: Fun Unlimited,tt0495034,2006.0,"Golmaal: Fun Unlimited is a 2006 Indian Hindi-language coming-of-age buddy comedy film directed by Rohit Shetty, written by Neeraj Vora, and produced by Dhilin Mehta under Shree Ashtavinayak Cine Vision Limited and Parag Sanghvi under K Sera Sera Private Limited. The first installment of the Golmaal film series, it stars Ajay Devgn, Tusshar Kapoor, Arshad Warsi and Sharman Joshi along with Rimi Sen and Paresh Rawal. Golmaal was released on 14 July 2006. It is considered a modern cult film.",Ajay Devgn; Arshad Warsi; Dhillin Mehta; Neeraj Vora; Paresh Rawal; Rimi Sen; Rohit Shetty; Sharman Joshi; Tusshar Kapoor,2000.0,9,True,Hindi
Imsai Arasan 23rd Pulikecei,tt0888503,2006.0,"Imsai Arasan 23rd Pulikecei is a 2006 Indian Tamil-language historical-comedy film written and directed by Chimbu Deven in his directoral debut .The film stars Vadivelu in his debut as a solo lead actor. Monica and Tejashree play the female leads, while Manorama, Nassar, Ilavarasu, Sreeman and Nagesh play supporting roles. Sabesh–Murali composed the soundtrack album and background score. S. Shankar produced and distributed the film under his production banner S Pictures.",Chimbu Deven; Nassar; S. Shankar; Tejashree; Vadivelu,2000.0,5,True,Tamil
Jaan-E-Mann,tt0456481,2006.0,"Jaan-E-Mann (transl. Beloved) is a 2006 Indian Hindi-language musical romance film directed by Shirish Kunder and was produced by Sajid Nadiawala. The film stars Salman Khan, Akshay Kumar and Preity Zinta. This was Kunder's debut film as a director. He also edited and wrote the screenplay and dialogue.",Akshay Kumar; Anupam Kher; Nawab Shah; Preity Zinta; Sajid Nadiadwala; Salman Khan; Shirish Kunder,2000.0,7,True,Hindi
Julie (2006 film),tt14338206,2006.0,,Poornima Indrajith; Ramya,2000.0,2,False,
June R,tt0475632,2006.0,,Biju Menon; Jyothika; Khushbu Sundar; Revathy S. Varmha; Saritha; Suriya,2000.0,6,False,
Kabul Express,tt0770214,2006.0,,Aditya Chopra; Arshad Warsi; John Abraham; Kabir Khan; Linda Arsenio; Roshan Seth; Salman Shahid; Yash Chopra,2000.0,8,False,
Keerthi Chakra (film),tt0485922,2006.0,,Biju Menon; Cochin Haneefa; Gopika; Jiiva; Lakshmi Gopalaswamy; Major Ravi; Mohanlal; Prakash Raj; Ramesh Khanna; shajimon,2000.0,10,False,
Kilukkam Kilukilukkam,tt1102252,2006.0,,Jagathy Sreekumar; Jayasurya Jayan; Kavya Madhavan; Kunchacko Boban; Mohanlal; Sandhya Mohan,2000.0,6,False,
Lion (2006 film),tt0928191,2006.0,,Dileep (Gopalakrishnan P Pillai); Joshiy; Kavya Madhavan,2000.0,3,False,
MLA Fatakeshto,tt4771812,2006.0,,Debashree Roy; Koel Mallick; Mithun Chakraborty; N.K. Salil; Rajatava Dutta; Shantilal Mukherjee; Soumitra Chatterjee; Swapan Saha,2000.0,8,False,
Pachakuthira,tt0808904,2006.0,,Dileep (Gopalakrishnan P Pillai); Gopika; Kamal; Salim Kumar; Sidhique; T A Shahid,2000.0,6,False,
Pattiyal,tt1034402,2006.0,"Pattiyal (transl. List) is a 2006 Indian Tamil-language crime thriller film written and directed by Vishnuvardhan and produced by Punnagai Poo Gheetha. It stars Bharath, Arya, Pooja Umashankar, and Padmapriya Janakiraman while Cochin Haneefa and Santhana Bharathi play pivotal roles. The film tackles the issue of dons and was based on the 1999 Thai film Bangkok Dangerous.",'Punnagai Poo' Gheetha; Arya; Bharath; Cochin Haneefa; Padmapriya Janakiraman; Pooja Umashankar; Vishnuvardhan,2000.0,7,True,Tamil
Perarasu (film),tt0811007,2006.0,,Udhayan; Vijayakanth,2000.0,2,False,
Photographer (film),tt0867401,2006.0,,Biju Menon; Mohanlal; Ranjan Pramod,2000.0,3,False,
Pokiri,tt0816258,2006.0,"Pokiri (transl. Rogue) is a 2006 Indian Telugu-language action thriller film written and directed by Puri Jagannadh. The film was produced by Jagannadh and Manjula Ghattamaneni by their respective production companies Vaishno Academy and Indira Productions. The film stars Mahesh Babu, Ileana D'Cruz, Prakash Raj, Nassar, Ashish Vidyarthi and Sayaji Shinde. In the film, a local goon whose killer instincts earns him not only his girlfriend's disapproval and a corrupt cop's enmity, but also the attention of a wanted crime boss.",Ajay; Ali; Ashish Vidyarthi; Brahmanandam; Ileana D'Cruz; Mahesh Babu; Manjula Ghattamaneni; Nassar; Prakash Raj; Puri Jagannadh; Sayaji Shinde; Sudha; Venu Madhav,2000.0,13,True,Telugu
Pyaar Ke Side Effects,tt0480572,2006.0,,Pritish Nandy; Rahul Bose; Saket Chaudhary,2000.0,3,False,
Quest (2006 film),tt0846071,2006.0,,Amol Palekar; Mukta Barve,2000.0,2,False,
Rakhi (2006 film),tt0924274,2006.0,,Brahmanandam; Chandra Mohan; Kota Srinivasa Rao; Krishna Vamsi; N. T. Rama Rao Jr.,2000.0,5,False,
Rang De Basanti,tt0405508,2006.0,,Aamir Khan; Alice Patten; Anupam Kher; Atul Kulkarni; Kirron Kher; Kunal Kapoor; Lekh Tandon; Mohan Agashe; Om Puri; Prasoon Joshi; R. Madhavan; Rakeysh Omprakash Mehra; Rensil D'Silva; Ronnie Screwvala; Sharman Joshi; Siddharth; Soha Ali Khan; Steven Mackintosh; Waheeda Rehman,2000.0,19,False,
Rasathanthram,tt0770203,2006.0,"Rasathanthram (transl. Chemistry) is a 2006 Indian Malayalam-language family drama film written and directed by Sathyan Anthikkad and starring Mohanlal and Meera Jasmine, with Bharath Gopi, Innocent, Oduvil Unnikrishnan, and Mamukkoya in prominent roles. The film was produced by Antony Perumbavoor through Aashirvad Cinemas. The soundtrack album was composed by Ilaiyaraaja, while Alagappan N. handled the cinematography.",Bharath Gopi; Innocent Vareed Thekkethala; Meera Jasmine; Mohanlal; Sathyan Anthikad,2000.0,5,True,Malayalam
Sacred Evil – A True Story,tt0466965,2006.0,,Abhigyan Jha; Ipsita Roy Chakraverti; Sarika,2000.0,3,False,
Shaadi Karke Phas Gaya Yaar,tt0430589,2006.0,,K. S. Adhiyaman; Salman Khan; Shilpa Shetty,2000.0,3,False,
Shaadi Se Pehle,tt0489560,2006.0,,Aftab Shivdasani; Akshaye Khanna; Ayesha Takia; Mallika Sherawat; Satish Kaushik; Subhash Ghai; Sunil Shetty,2000.0,7,False,
Short Cut to Nirvana: Kumbh Mela,tt0420723,2006.0,,,2000.0,0,False,
Sivappathigaram,tt2084939,2006.0,,Karu Pazhaniappan; Vishal,2000.0,2,False,
Stalin (2006 film),tt0366180,2006.0,,A. R. Murugadoss; Brahmanandam; Chiranjeevi; Khushbu Sundar; Nagendra Babu; Prakash Raj; Ravali; Sharada; Trisha Krishnan,2000.0,9,False,
Sudesi,tt0824704,2006.0,,Ashima Bhalla; Karunas; Livingston; Mansoor Ali Khan; Sayaji Shinde; Vijayakanth,2000.0,6,False,
The Pink Mirror,tt0386499,2006.0,,Sridhar Rangayan,2000.0,1,False,
Thirupathi (2006 Tamil film),tt0876291,2006.0,,Ajith Kumar; M. S. Guhan; M. Saravanan; Perarasu,2000.0,4,False,
Umar (film),tt0785069,2006.0,,Dalip Tahil; Jimmy Shergill; Kader Khan; Karan Razdan; Prem Chopra; Satish Kaushik; Shakti Kapoor; Shenaz Treasurywala,2000.0,8,False,
Vanaja (film),tt0832971,2006.0,,Mamatha Bhukya; Rajnesh Domalpalli,2000.0,2,False,
Varalaru,tt0442781,2006.0,,Ajith Kumar; Asin; K. S. Ravikumar; Kanika; S. S. Chakravarthy; Sujatha Rangarajan,2000.0,6,False,
Vathiyar,tt6765648,2006.0,,A. Venkatesh; D. Imman; Firoz Khan; Mallika Kapoor; Manivannan; Prakash Raj; Vadivelu,2000.0,7,False,
Vettaiyaadu Vilaiyaadu,tt0455829,2006.0,,Daniel Balaji; Gautham Vasudev Menon; Jyothika; Kamal Haasan; Prakash Raj,2000.0,5,False,
Vikramarkudu,tt0858492,2006.0,"Vikramarkudu is a 2006 Indian Telugu-language action drama film co-written and directed by S. S. Rajamouli, based on a story by V. Vijayendra Prasad. Produced by M. L. Kumar Chowdary, the film stars Ravi Teja and Anushka. The music was composed by M. M. Keeravani, with cinematography by Sarvesh Murari. The plot follows a thief who encounters a young girl claiming to be his daughter, leading him to uncover his connection to her real father, a look-alike with a turbulent past.",Ajay; Anushka Shetty; Brahmanandam; Prakash Raj; Raghu Babu; Rajiv Kanakala; Ravi Teja; Ruthika; S. S. Rajamouli; Vineet Kumar,2000.0,10,True,Telugu
Vivah,tt0494290,2006.0,"Vivah is a 2006 Indian Hindi-language romantic drama film, written and directed by Sooraj R. Barjatya. Produced and distributed by Rajshri Productions, the film stars Shahid Kapoor and Amrita Rao as lead, alongside Anupam Kher, Alok Nath, Seema Biswas, Amrita Prakash, Samir Soni and Lata Sabharwal. Vivah tells the story of two individuals, and relates their journey from engagement to marriage and aftermath.",Alok Nath; Amrita Rao; Anupam Kher; Shahid Kapoor; Sooraj R. Barjatya,2000.0,5,True,Hindi
Yun Hota Toh Kya Hota,tt0470614,2006.0,,Ayesha Takia; Boman Irani; Irrfan Khan; Jimmy Shergill; Konkona Sen Sharma; Naseeruddin Shah; Paresh Rawal; Prashant Shah; Ratna Pathak; Saroj Khan; Uttam Gada,2000.0,11,False,
7½ Phere,tt0453582,2005.0,"7+1⁄2 Phere: More Than a Wedding is a 2005 Indian Hindi-language black comedy film directed by Ishaan Trivedi and produced by Nimit Modawal. It stars Juhi Chawla and Irrfan Khan in the lead roles. The film was released in India on 29 July 2005, to mixed response.",Ishaan Trivedi; Juhi Chawla,2000.0,2,True,Hindi
Andha Naal Nyabagam,tt13746724,2005.0,"Andha Naal Nyabagam is a 2005 Tamil-language romantic drama film written and directed by Mani Bharathi, who earlier directed Anbe Anbe (2003). The film stars Ramana, Sridevika and Tejashri. The film's title is based off of a song from Uyarndha Manithan (1968).",Ramana; Tejashree,2000.0,2,True,Tamil
Anniyan,tt0376127,2005.0,"Anniyan ( transl. Stranger) is a 2005 Indian Tamil-language psychological action thriller film directed by S. Shankar and produced by V. Ravichandran. The film stars Vikram as a law-abiding lawyer who suffers from dissociative identity disorder, and develops two other identities: a fashion model, and a murderous vigilante seeking to eradicate corrupution. The cast also includes Sadha, Prakash Raj, Vivek, Nedumudi Venu, Nassar.",S. Shankar; Vikram; Viswanathan Ravichandran,2000.0,3,True,Tamil
Ben Johnson (film),tt0468665,2005.0,"Ben Johnson is a 2005 Indian Malayalam-language action thriller film directed by Anil C. Menon, written by T. A. Shahid, and produced by Milan Jaleel. It stars Kalabhavan Mani in dual roles as father and son, alongside Indraja, Siddique, Harisree Ashokan and Vijayaraghavan in supporting roles. The songs were composed by Deepak Dev.",Sukumari,2000.0,1,True,Malayalam
Bharathchandran I.P.S.,tt0463429,2005.0,"Bharathchandran I.P.S is a 2005 Indian Malayalam-language action drama film written, directed and produced by Renji Panicker. It is a sequel to the 1994 film Commissioner and Suresh Gopi reprises the titular character, while Sai Kumar, Rajan P. Dev, Mamukkoya, Shreya Reddy and Lalu Alex appear in supporting roles. The background score was composed by C. Rajamani.",Rajan P. Dev; Renji Panicker; Saikumar; Suresh Gopi,2000.0,4,True,Malayalam
Black (2005 film),tt0375611,2005.0,"Black is a 2005 Indian drama film co-written, directed, and co-produced by Sanjay Leela Bhansali. It stars Amitabh Bachchan and Rani Mukerji in lead roles, with Ayesha Kapur, Shernaz Patel and Dhritiman Chatterjee in supporting roles. The film narrates the story of Michelle (Mukerji), a deafblind woman, and her relationship with her teacher Debraj (Bachchan), an elderly alcoholic teacher who himself later develops Alzheimer's disease.",Amitabh Bachchan; Bhavani Iyer; Nandana Sen; Rani Mukerji; Sanjay Leela Bhansali; Shernaz Patel,2000.0,6,True,
Bluffmaster!,tt0476527,2005.0,"Bluffmaster! is a 2005 Indian Hindi-language crime comedy film directed by Rohan Sippy and produced by Ramesh Sippy. The film stars Abhishek Bachchan, Riteish Deshmukh, Priyanka Chopra, Sanjay Mishra, Boman Irani and Nana Patekar. It is an adaptation of the 2000 Argentine film Nine Queens. It follows a conman who gets dumped by his girlfriend and after realising he is suffering from a severe illness, decides to help a new apprentice before dying.",Abhishek Bachchan; Boman Irani; Nana Patekar; Priyanka Chopra; Ramesh Sippy; Riteish Deshmukh; Rohan Sippy,2000.0,7,True,Hindi
Boyy Friennd,tt0482910,2005.0,"Boyy Friennd is a 2005 Indian Malayalam-language romantic drama film directed by Vinayan and written by J. Pallassery from a story by Vinayan. The film stars Manikuttan, Sreenivasan, Mukesh, Madhumitha, Honey Rose and Lakshmi Gopalaswamy. The film was released on 28 October 2005. This movie marked the debut of Honey Rose.",J. Pallassery; Lakshmi Gopalaswamy; Manikuttan; Mukesh; Sreenivasan; Vinayan,2000.0,6,True,Malayalam
Bride and Prejudice,tt0361411,2005.0,"Bride and Prejudice is a 2004 romantic comedy-drama film directed by Gurinder Chadha. The screenplay by Chadha and Paul Mayeda Berges is a Bollywood-style adaptation of Jane Austen's 1813 novel Pride and Prejudice. Shot primarily in English, with some Hindi and Punjabi dialogue, the film was released in the United Kingdom on 6 October 2004 and in the United States on 11 February 2005 to mostly positive reviews from critics.",Aishwarya Rai Bachchan; Alexis Bledel; Anu Malik; Anupam Kher; Ashanti; Daniel Gillies; Georgina Chapman; Gurinder Chadha; Indira Varma; Marsha Mason; Martin Henderson; Nadira Babbar; Namrata Shirodkar; Naveen Andrews; Nitin Ganatra; Peeya Rai Chowdhary; Rick Warden; Shivaani Ghai; Sonali Kulkarni,2000.0,19,True,
Chakram (2005 film),tt0455385,2005.0,"Chakram (transl. Wheel) is a 2005 Indian Telugu-language drama film co-written and directed by Krishna Vamsi. It stars Prabhas in lead role as the titular character, while Asin and Charmy Kaur play the female leads. The music was composed by Chakri. The film was released on 25 March 2005 to mixed reviews and became a flop at the box office. However, it won two Nandi Awards. The film was dubbed in Bhojpuri under the same name and in Malayalam as Dharma Chakram.",Asin; Basavaraju Venkata Padmanabha Rao; Brahmanandam; Charmy Kaur; Krishna Vamsi; Prabhas; Prakash Raj,2000.0,7,True,Telugu
Chandramukhi,tt0449869,2005.0,"Chandramukhi is a 2005 Indian Tamil-language psychological comedy horror film written and directed by P. Vasu. It is a remake of Vasu's Kannada film Apthamitra (2004) which itself was based on the Malayalam film Manichitrathazhu (1993). The film stars Rajinikanth, Prabhu and Jyothika along with an ensemble supporting cast, including Vadivelu, Nayanthara, Nassar and Sheela. It revolves around a woman who suffers from dissociative identity disorder that affects a family, and a psychiatrist who intends to solve the case while risking his life.",Jyothika; Nayanthara; P. Vasu; Prabhu Ganesan; Rajini kanth; Ramkumar Ganesan,2000.0,6,True,Tamil
Chandrolsavam,tt0448408,2005.0,"Chandrolsavam is a 2005 Indian Malayalam-language action drama film written and directed by Ranjith. It stars Mohanlal and Meena in the lead role with Ranjith, Cochin Haneefa, VK Sreeraman, Santhosh, and Jagadish in supporting roles. V. Dakshinamoorthy makes a cameo appearance as Sreehari's guru. The film features music composed by Vidyasagar.",Mohanlal; Ranjith,2000.0,2,True,Malayalam
Chanthupottu,tt0400186,2005.0,"Chanthupottu is a 2005 Indian Malayalam-language romantic comedy-drama film directed by Lal Jose, written by Benny P. Nayarambalam, and produced by Lal. The film was based on a play of the same name, which in turn, was based on the life of an actual man with feminine mannerisms. The story is about a man named Radhakrishnan (Dileep) who was brought up like a girl by his grandmother. The film was a commercial success at the box office.",Benny P. Nayarambalam; Bhavana; Dileep (Gopalakrishnan P Pillai); Gopika; Indrajith Sukumaran; Lal; Lal Jose,2000.0,7,True,Malayalam
Chatrapathi (2005 film),tt0843328,2005.0,"Chatrapathi is a 2005 Indian Telugu-language action drama film directed by S. S. Rajamouli, who also co-wrote the film with V. Vijayendra Prasad. The film stars Prabhas in the title role alongside Shriya Saran, Bhanupriya, Shafi and Pradeep Rawat playing supporting roles. M. M. Keeravani composed the music. The film was produced by B. V. S. N. Prasad on Sri Venkateswara Cine Chitra banner.",Ajay; B. V. S. N. Prasad; Bhanupriya; Chatrapathi Sekhar; Jaya Prakash Reddy; Jeeva; Kamal Kamaraju; Karate Kalyani; Kota Srinivasa Rao; L. B. Sriram; Manoj Nandam; Narendra Jha; Prabhas; Pradeep Rawat; S. S. Rajamouli; Shafi; Shriya Saran; Subbaraya Sharma; Supreeth; Surya; Venu Madhav,2000.0,21,True,Telugu
Daivanamathil,tt0461187,2005.0,"Daivanamathil is a 2005 Indian Malayalam-language film directed by Jayaraj and written and produced by Aryadan Shoukath. The film is based on the Demolition of the Babri Masjid in December 1992, which had its repercussions on Muslims in Kerala. It features Prithviraj Sukumaran and Bhavana in the lead roles.",Aryadan Shoukath; Bhavana; Cochin Haneefa; Jayarajan Rajasekharan Nair; Prithviraj Sukumaran,2000.0,5,True,Malayalam
Deadly Soma,tt3581956,2005.0,"Deadly Soma is a 2005 Indian Kannada-language biographical crime film written and directed by Ravi Srivatsa. The film is based on the real life incidents of an infamous underworld don, Deadly Soma. The film stars Aditya in the title role and Rakshita. Tara, Devaraj and Avinash play other pivotal roles.",Aditya; Ravi Belagere; Ravi Srivatsa,2000.0,3,True,Kannada
Dombivli Fast,tt0833444,2005.0,"Dombivli Fast is a 2005 Indian Marathi-language psychological action drama film directed by Nishikanth Kamat. It is the story of a middle class bank employee, Madhav Apte, an ordinary, law-abiding and honest citizen who faces constant frustration with the injustice and corruption that pervades in all walks of his life. The film portrays Apte's mental breakdown as he reaches his breaking point, and his rampage as a vigilante across Mumbai to set things right. The film stars Sandeep Kulkarni in the lead with Shilpa Tulaskar and Sandesh Jadhav.",Nishikant Kamat; Sandeep Kulkarni; Shilpa Tulaskar,2000.0,3,True,Marathi
Dreaming Lhasa,tt0469686,2005.0,"Dreaming Lhasa is a Tibetan-language film by veteran documentary filmmakers, Ritu Sarin and Tenzing Sonam, who have been making films about various aspects of Tibet under the banner of White Crane Films since 1990. Written by Tenzing, a first-generation Tibetan born and brought up in exile, Dreaming Lhasa is perhaps, the first Tibetan feature film to explore the state of exile and the issues of identity, culture and politics as they affect the Tibetan refugee community in India.",Ritu Sarin; Tenzing Sonam,2000.0,2,True,
Emma Goes to Bollywood,tt6405952,2005.0,Emma Goes to Bollywood is a 2005 British documentary film produced and broadcast by BBC Two. It was directed by Louis Theroux and released on 12 June 2005. It stars Emma Bunton on her travel to Bollywood.,Emma Bunton; Louis Theroux,2000.0,2,True,
Ghajini (2005 film),tt0449951,2005.0,"Ghajini is a 2005 Indian Tamil-language action thriller film directed by A. R. Murugadoss and produced by Salem Chandrasekharan. The film stars Suriya, Asin, Nayanthara and Pradeep Rawat. Harris Jayaraj composed the soundtrack and background music, while R. D. Rajasekhar and Anthony were the film's cinematographer and editor, respectively. In the film, a rich eminent businessman develops anterograde amnesia due to a head injury he sustains while attempting to save his lover from getting murdered by a gangster and human trafficker. After that, he sets out to avenge her murder with the aid of photographs from an instant camera and permanent tattoos on his body.",A. R. Murugadoss; Asin; Nayanthara; Salem Chandrasekharan; Suriya,2000.0,5,True,Tamil
Iqbal (film),tt0453729,2005.0,,Girish Karnad; Nagesh Kukunoor; Naseeruddin Shah; Prateeksha Lonkar; Shreyas Talpade; Shweta Prasad; Subhash Ghai; Vipul K Rawal; Yatin Karyekar,2000.0,9,False,
Iruvattam Manavaatti,,2005.0,,Harisree Ashokan; Indrans; Kalabhavan Mani; Kavya Madhavan; Kunchacko Boban; Madhu Warrier; Murali,2000.0,7,False,
Iyer IPS,tt3961528,2005.0,,Sathyaraj,2000.0,1,False,
Kana Kandaen,tt0455578,2005.0,,Gopika; K. V. Anand; P. L. Thenappan; Prithviraj Sukumaran; Srikanth; Vivek,2000.0,6,False,
Kanda Naal Mudhal,tt0808892,2005.0,,Karthik Kumar; Laila Mehdin; Prakash Raj; Prasanna; Revathi; V. Priya; Yaragudipati Venkata Mahalakshmi,2000.0,7,False,
Karam (film),tt0444849,2005.0,,John Abraham; Pammi Baweja; Priyanka Chopra; Sanjay F. Gupta,2000.0,4,False,
Koi Aap Sa,tt0488840,2005.0,,Aftab Shivdasani; Anita Hassanandani; Dheeraj Sarna; Ekta Kapoor; Partho Mitra; Shobha Kapoor,2000.0,6,False,
Krithyam,tt0468785,2005.0,,Jagathy Sreekumar; Kalpana; Prithviraj Sukumaran; Viji Thampi,2000.0,4,False,
Kyaa Kool Hain Hum,tt0456500,2005.0,,Ekta Kapoor; Riteish Deshmukh; Sachin Yardi; Sangeeth Sivan; Shobha Kapoor; Tusshar Kapoor,2000.0,6,False,
Maine Pyaar Kyun Kiya?,tt0451803,2005.0,"Maine Pyaar Kyun Kiya is a 2005 Indian Hindi-language romantic comedy film directed by David Dhawan. It is a remake of the 1969 American film, Cactus Flower which was an adaptation of the 1965 play of the same name by Abe Burrows, itself based on the French play Fleur de cactus by Pierre Barillet and Jean-Pierre Gredy.",Arbaaz Khan; Arshad Warsi; David Dhawan; Dhillin Mehta; Katrina Kaif; Salman Khan; Sanjay Chhel; Sohail Khan; Sushmita Sen,2000.0,9,True,Hindi
My Brother…Nikhil,tt0419992,2005.0,,Juhi Chawla; Onir; Peeya Rai Chowdhary; Sanjay Suri; Victor Banerjee,2000.0,5,False,
"Nalini by Day, Nancy by Night",tt0491074,2005.0,,Sonali Gulati,2000.0,1,False,
News (film),,2005.0,,Upendra,2000.0,1,False,
Page 3 (film),tt0443708,2005.0,,Atul Kulkarni; Boman Irani; Konkona Sen Sharma; Madhur Bhandarkar; Manoj Tyagi,2000.0,5,False,
Paheli (2005 film),tt0451850,2005.0,"Paheli is a 2005 Indian Hindi-language fantasy film directed by Amol Palekar and produced by Gauri Khan. The film tells the story of a wife whose husband goes on a business trip and is visited by a ghost, disguised as her husband, who is in love with her and takes her husband's place. The supporting cast includes Anupam Kher, Amitabh Bachchan, Juhi Chawla and Suniel Shetty. Based on the Rajasthani short story ""Duvidha"" by Vijayadan Detha, it is a remake of the 1973 Hindi film Duvidha by Mani Kaul.",Amitabh Bachchan; Amol Palekar; Anupam Kher; Gauri Khan; Juhi Chawla; Naseeruddin Shah; Rajpal Yadav; Rani Mukerji; Shah Rukh Khan; Sunil Shetty,2000.0,10,True,Hindi
Parzania,tt0433425,2005.0,,Corin Nemec; David N. Donihue; Naseeruddin Shah; Parzan Dastur; Rahul Dholakia; Rajendranath Zutshi; Sarika,2000.0,7,False,
Power of Women (film),tt2275694,2005.0,,Jayadevī; Khushbu Sundar; P. Jayadevi,2000.0,3,False,
Priyasakhi,tt0453188,2005.0,,K. S. Adhiyaman; R. Madhavan; Ramesh Khanna; Sadha; Singanamala Ramesh,2000.0,5,False,
Ramji Londonwaley,tt0476848,2005.0,,Amitabh Bachchan; R. Madhavan; Sanjay Dayma; Sunanda Murali Manohar,2000.0,4,False,
Salaam Namaste,tt0456165,2005.0,"Salaam Namaste is a 2005 Indian Hindi-language romantic comedy-drama film written and directed by Siddharth Anand in his directorial debut and produced by Aditya Chopra under Yash Raj Films. The film stars Saif Ali Khan and Preity Zinta in lead roles, alongside a supporting cast of Arshad Warsi, Tania Zaetta and Jugal Hansraj. The film was released on 9 September 2005, and was the first Indian film to be shot entirely in Australia.",Abhishek Bachchan; Aditya Chopra; Arshad Warsi; Javed Jaffrey; Jugal Hansraj; Maria Goretti; Preity Zinta; Saif Ali Khan; Siddharth Anand; Tania Zaetta; Yash Chopra,2000.0,11,True,Hindi
Sarkar Dada,tt1102325,2005.0,,Jayaram; Sasi Shanker,2000.0,2,False,
Sehar,tt0477857,2005.0,,Arshad Warsi; Kabeer Kaushik; Mahima Chaudhry; Pankaj Kapur,2000.0,4,False,
Shaadi No. 1,tt0449389,2005.0,,David Dhawan; Sanjay Dutt; Vashu Bhagnani,2000.0,3,False,
Tango Charlie,tt0444913,2005.0,,Ajay Devgn; Alok Nath; Bobby Deol; Mani Shankar; Nandana Sen; Rajendranath Zutshi; Sanjay Dutt; Sunil Shetty; Tanishaa,2000.0,9,False,
Thanmathra,tt0483180,2005.0,"Thanmathra is a 2005 Indian Malayalam-language drama film written and directed by Blessy and starring Mohanlal, Meera Vasudevan and Arjun Lal. Based on Padmarajan's short story ""Orma"", it portrays the effects of Alzheimer's disease on the life of Ramesan Nair (Mohanlal) and his family. The film collected three times its budget at the box-office and completed 150 days run.",Blessy; Mohanlal,2000.0,2,True,Malayalam
Udayon,tt0460592,2005.0,,Bhadran; Innocent Vareed Thekkethala; Kalabhavan Mani; Laya; Manoj K. Jayan; Mohanlal; Nassar; Salim Ghouse; Subair,2000.0,9,False,
Vishnu Sena,,2005.0,,Naganna; Vishnuvardhan,2000.0,2,False,
